A1: TEAM FIREFOX
A2: BILL OF MATERIALS
C4: Quantity | D4: Cost/Unit | E4: Cost
A5: Mechanical Components
A6: Structural
B7: wheel ball bearings | C7: 1 | D7: 7.50 | E7: =C7*D7 -> 7.50
B8: Wheels 110mm | C8: 2 | D8: 14.00 | E8: =C8*D8 -> 28.00
B9: Threaded rod | C9: 1 | D9: 1.00 | E9: =C9*D9 -> 1.00
B10: Drive Train Pulleys | C10: 4 | D10: 8.00 | E10: =C10*D10 -> 32.00
B11: Drive Train Belts | C11: 2 | D11: 4.00 | E11: =C11*D11 -> 8.00
B12: Gears for arm | C12: 2 | D12: 1.00 | E12: =C12*D12 -> 2.00
B13: Nuts, Bolts, and washers | C13: many | D13: 5.00 | E13: =D13 -> 5.00
B14: Masonite | C14: - | D14: 218A | E14: 0.00
B15: Acrylic | C15: - | D15: Cabinet of Freedom | E15: 0.00
A16: Electrical Components
A17: Hardware
B18: 2"x3" Perf boards | C18: 3 | D18: 2.00 | E18: =C18*D18 -> 6.00
B19: 20 pin socket | C19: 1 | D19: 0.50 | E19: =C19*D19 -> 0.50
B20: 24 pin socket | C20: 1 | D20: 0.60 | E20: =C20*D20 -> 0.60
B21: 14 pin socket | C21: 2 | D21: 0.40 | E21: =C21*D21 -> 0.80
B22: Batteries | C22: 2 | D22: 11.00 | E22: =C22*D22 -> 22.00
B23: Battery wires | C23: 2 | D23: 3.50 | E23: =C23*D23 -> 7.00
B24: Fuse | C24: 1 | D24: 1.30 | E24: =C24*D24 -> 1.30
B25: blue battery power | C25: 2 | D25: 0.65 | E25: =C25*D25 -> 1.30
B26: QRB1134 Tape Sensors | C26: 5 | D26: 2.00 | E26: =C26*D26 -> 10.00
B27: twisted pair wire | C27: - | D27: 218A | E27: 0.00
B28: Crimp Pins | C28: 96 | D28: 0.10 | E28: =C28*D28 -> 9.60
B29: 2 pin molex | C29: 19 | D29: 0.06 | E29: =C29*D29 -> 1.14
B30: 3 pin molex | C30: 1 | D30: 0.08 | E30: =C30*D30 -> 0.08
B31: 4 pin molex | C31: 11 | D31: 0.10 | E31: =C31*D31 -> 1.10
B32: 2 pin molex male | C32: =C29 -> 19 | D32: 0.05 | E32: =C32*D32 -> 0.95
B33: 3 pin molex male | C33: =C30 -> 1 | D33: 0.05 | E33: =C33*D33 -> 0.05
B34: 4 pin molex male | C34: =C31 -> 11 | D34: 0.10 | E34: =C34*D34 -> 1.10
B35: heat sinks | C35: 2 | D35: 0.35 | E35: =C35*D35 -> 0.70
A36: Small Circuit Components
B37: Resistors | C37: 27 | D37: 0.01 | E37: =C37*D37 -> 0.27
B38: Small Capacitors | C38: 2 | D38: Lab Kit | E38: 0.00
B39: Large Capacitors | C39: 4 | D39: Lab Kit | E39: 0.00
B40: Diodes | C40: 0 | D40: Lab Kit | E40: 0.00
B41: LEDs | C41: 4 | D41: Lab Kit | E41: 0.00
B42: Jumbo LEDs | C42: 2 | D42: 218A | E42: 0.00
B43: 2N7000 Transistors | C43: 2 | D43: Lab Kit | E43: 0.00
A44: Chips
B45: TLE-5206 Hbridges | C45: 2 | D45: 9.50 | E45: =C45*D45 -> 19.00
B46: IRFU5305 Meghan | C46: 1 | D46: 1.75 | E46: =C46*D46 -> 1.75
B47: LM7805C Voltage Regulator | C47: 1 | D47: 0.26 | E47: =C47*D47 -> 0.26
B48: LM324 | C48: 2 | D48: Lab Kit | E48: 0.00
B49: L293B Motor Driver | C49: 1 | D49: Lab Kit | E49: 0.00
A50: Motors
B51: Maxton 0910 144035 | C51: 2 | D51: Donated | E51: 0.00
B52: 42BYG228-R Stepper Motor | C52: 1 | D52: 218A | E52: 0.00
B53: 1 small servo | C53: 1 | D53: 4.00 | E53: =C53*D53 -> 4.00
B54: Motor cables | C54: 2 | D54: 1.00 | E54: =C54*D54 -> 2.00
A55: Time Component
B56: Steve | C56: (Infinity - when his mom visited) hours | D56: 6 Pack of Mountain Dew/day | E56: Grumpiness
B57: Justin | C57: (Infinity - going swimming) hours | D57: 1 Chorizo Burrito/hour | E57: Lack of Sleep
B58: Elisha | C58: (Infinity + 1) hours | D58: 1 learning experience/project | E58: Getting Sick
A59: Total Cost | E59: =SUM(E7:E54) -> 175